{
	"$schema": "https://json-schema.org/draft/2020-12/schema",
	"$id": "https://ring.indienodes.us/schema/ring-entry.json",
	"title": "Ring entry",
	"description": "A single entry in ring.json. See docs/submission-form-spec.md section 2.1 for the field-by-field notes.",
	"type": "object",
	"additionalProperties": false,
	"$defs": {
		"externalMediaUrl": {
			"type": "string",
			"format": "uri",
			"pattern": "^https://",
			"maxLength": 2000,
			"not": {
				"pattern": "^https://([a-z0-9-]+\\.)*indienodes\\.us(/|$)"
			},
			"description": "An https URL to media hosted somewhere the creator controls, never on IndieNodes itself. The no-rehosting principle is the whole shape of this project, and encoding it here means `npm run validate:publish` enforces it on every entry rather than it living only as a sentence in the submission spec. `maxLength` is the same rough ceiling browsers and servers already treat as a practical URL length limit -- generous for any real URL, a bound against a pathological one. Whether the URL actually resolves somewhere safe (not a private IP, not localhost, no embedded credentials) is `validate-ring.js`'s job, not this schema's: that rule needs a private-IP-range table a JSON Schema pattern cannot cleanly express, and it already exists once, in `member-health.js`."
		}
	},
	"required": [
		"id",
		"creator",
		"type",
		"why",
		"source_url",
		"tags",
		"verification_token",
		"joined_at"
	],
	"properties": {
		"id": {
			"type": "string",
			"pattern": "^[a-z0-9]+(-[a-z0-9]+)*$",
			"maxLength": 60,
			"description": "Unique slug, lowercase with hyphens."
		},
		"creator": {
			"type": "string",
			"minLength": 1,
			"maxLength": 100
		},
		"creator_id": {
			"type": "string",
			"minLength": 1,
			"maxLength": 100,
			"description": "Stable identifier linking this creator's nodes together. Assigned by the submission workflow, not the form. A data-only link: no ranking or weighting logic reads it. At most two nodes may share a creator_id, enforced as a moderation-checklist rule rather than in this schema."
		},
		"type": {
			"type": "string",
			"enum": ["audio", "comic", "text", "game", "art", "craft"]
		},
		"why": {
			"type": "string",
			"minLength": 1,
			"maxLength": 75,
			"description": "A node represents a creator, not a single work: this is the one-line pitch where the creator makes their case, introduction and framing combined. Matches submissionValidation.js's own WHY_MAX_LENGTH -- that file used to be the only place this was enforced; now both agree, rather than the schema silently trusting a client-side cap it could not see."
		},
		"source_url": {
			"type": "string",
			"format": "uri",
			"pattern": "^https://",
			"maxLength": 2000
		},
		"ring_page_url": {
			"type": "string",
			"format": "uri",
			"pattern": "^https://",
			"maxLength": 2000,
			"description": "Optional. A page on the same site as source_url that carries the member's ring embed, for members who keep it on a links or webrings page rather than on source_url or their home page. Member link health looks here as well as at source_url and its site root. Same site means the same hostname ignoring a leading www.; a JSON Schema pattern cannot compare two fields, so that rule is enforced by the submission form, the n8n intake and approval, validate-ring.js and member-health.js. Never rendered by the app."
		},
		"tags": {
			"type": "array",
			"minItems": 1,
			"maxItems": 20,
			"description": "At least one. Tags are how an entry becomes reachable: an untagged entry is invisible to the tag filters and to the tag list in Settings, so it would join the ring already unfindable by every route except scrolling past it. Capped at 20 as a sanity bound, not a product target -- real entries carry a handful.",
			"items": {
				"type": "string",
				"minLength": 1,
				"maxLength": 30
			},
			"default": []
		},
		"form": {
			"type": "string",
			"enum": ["music", "spoken"],
			"description": "Audio only, and required (see allOf below); must not appear on any other type. Declares whether the audio is music or spoken-word content (narration, audio drama, voice work), so playback queues never mix the two -- tags alone can't do this, since a spoken piece and a soundtrack can share every tag. No default: a silent default of `music` would mislabel spoken entries, so existing audio entries must have this added explicitly rather than backfilled automatically."
		},
		"tracks": {
			"type": "array",
			"maxItems": 3,
			"description": "Audio only, and optional. Capped at three so the ring stays a sampler, not a full catalog host. An audio entry with no tracks is a deliberate, supported shape: a link-only member, listed in the ring with its cover and a link out but not playable in-app. Playback needs a direct file the browser can fetch cross-origin (see docs/open-questions.md), which not every creator can supply, and refusing those creators entry would serve the ring worse than listing them.",
			"items": {
				"type": "object",
				"additionalProperties": false,
				"required": ["label", "media_url"],
				"properties": {
					"label": {
						"type": "string",
						"minLength": 1,
						"maxLength": 100
					},
					"media_url": {
						"$ref": "#/$defs/externalMediaUrl"
					}
				}
			}
		},
		"pages": {
			"type": "array",
			"maxItems": 5,
			"description": "Comic and craft. The outer cap of five is craft's; the allOf below holds comic to three, matching tracks/artworks/excerpts's own \"sampler, not a full catalog host\" reasoning above. A craft page is one photograph of a made object (full view, detail), and its caption is required: it carries materials and scale, and is the image's text alternative.",
			"items": {
				"type": "object",
				"additionalProperties": false,
				"required": ["image_url"],
				"properties": {
					"image_url": {
						"$ref": "#/$defs/externalMediaUrl"
					},
					"caption": {
						"type": "string",
						"maxLength": 200
					}
				}
			}
		},
		"artworks": {
			"type": "array",
			"minItems": 1,
			"maxItems": 3,
			"description": "Art only. One to three works selected to represent the creator rather than a full catalog.",
			"items": {
				"type": "object",
				"additionalProperties": false,
				"required": ["image_url", "alt"],
				"properties": {
					"image_url": {
						"$ref": "#/$defs/externalMediaUrl"
					},
					"alt": {
						"type": "string",
						"minLength": 1,
						"maxLength": 300,
						"description": "A meaningful text alternative for the artwork."
					},
					"title": {
						"type": "string",
						"minLength": 1,
						"maxLength": 100
					},
					"year": {
						"type": "string",
						"minLength": 1,
						"maxLength": 20
					},
					"medium": {
						"type": "string",
						"minLength": 1,
						"maxLength": 200
					},
					"external_url": {
						"type": "string",
						"format": "uri",
						"pattern": "^https://",
						"maxLength": 2000
					}
				}
			}
		},
		"excerpts": {
			"type": "array",
			"minItems": 1,
			"maxItems": 3,
			"description": "Text only. Between one and three short samples. Each sample's own audio is optional: when a creator supplies none, the reader hears an automatic text-to-speech reading instead. Two item shapes are valid on purpose: the object form every new submission produces, and the bare string form entries published before samples carried their own audio. Both are accepted so existing member files stay valid without a migration; `normalizeEntry` in src/lib/ring.js lifts the string form to the object form at read time, so nothing downstream of it sees two shapes.",
			"items": {
				"oneOf": [
					{
						"type": "object",
						"additionalProperties": false,
						"required": ["text"],
						"properties": {
							"title": {
								"type": "string",
								"minLength": 1,
								"maxLength": 100,
								"description": "Optional name for this sample — a chapter, an essay title, a poem's first line. Omitted is a complete sample, not an incomplete one: an excerpt from an untitled piece has nothing to put here."
							},
							"text": {
								"type": "string",
								"minLength": 1,
								"maxLength": 5000,
								"description": "Sanitized HTML for this sample. 5000 characters is generous room for a genuine short excerpt -- a few paragraphs -- while still bounding how much any one sample can grow."
							},
							"audio_url": {
								"$ref": "#/$defs/externalMediaUrl",
								"description": "The creator's own recording of this sample, read aloud. Omitted means text-to-speech is used instead."
							}
						}
					},
					{
						"type": "string",
						"minLength": 1,
						"maxLength": 5000,
						"description": "Legacy plain-text sample, still valid and never rewritten in place. New submissions emit the object form above."
					}
				]
			}
		},
		"feeds": {
			"type": "array",
			"maxItems": 10,
			"description": "The creator's own feeds elsewhere -- RSS, Atom, a JSON Feed, Bluesky, Mastodon, YouTube, a podcast feed, or another kind named by a free-form `type`. Additive and entirely optional: a member with none is exactly as supported as before this field existed, discoverable by source_url alone. A reader client (indienodes-app's own player, or a third party like YipDen) uses this to follow a creator's ongoing output rather than only the sampler featured here. Capped at 10 as a sanity bound, the same reasoning as tags's own cap, not a product target.",
			"items": {
				"type": "object",
				"additionalProperties": false,
				"required": ["type", "url"],
				"properties": {
					"type": {
						"type": "string",
						"minLength": 1,
						"maxLength": 40,
						"description": "rss, atom, jsonfeed, bluesky, mastodon, youtube, and podcast are the kinds a reader is expected to label distinctly; any other value is accepted and can be rendered generically, matching this project's posture of never closing a set a future feed kind might need to join."
					},
					"url": {
						"$ref": "#/$defs/externalMediaUrl"
					},
					"verified": {
						"type": "boolean",
						"description": "Whether this feed's own profile links back to source_url with a two-way rel=\"me\". Self-declared like every other field here; unverified is the default and is not a rejection, the same posture explicit and discoverable below take."
					}
				}
			}
		},
		"discoverable": {
			"type": "boolean",
			"default": true,
			"description": "A creator's own opt-out from randomized or rotating discovery surfaces (false hides the Node from those) while it stays in the ring exactly as before: reachable by direct link, the member directory, and Previous/Next/Random widget navigation. Omitted means true. Never set by a reviewer, by link health, or by any ranking -- this is the creator's own switch, the same posture that nothing about a member's own site or presence here changes without their say."
		},
		"layout": {
			"type": "string",
			"enum": ["mobile-friendly", "desktop-first"],
			"description": "Self-declared hint about how the creator's own source_url is best experienced. Optional and presentational only -- no client is required to act on it, and unlike type or form it never gates validation or playback."
		},
		"thumb_url": {
			"$ref": "#/$defs/externalMediaUrl",
			"description": "Cover or representative image for the entry: album art, a header image, a screenshot. Required for game entries (see allOf below); optional and encouraged for every other type, where the field view uses it as the card's background instead of a flat color wash. Comics, Craft and Art fall back to their first page or artwork when this is absent."
		},
		"thumb_position": {
			"type": "object",
			"additionalProperties": false,
			"required": ["x", "y"],
			"description": "Normalized focal point for cropping a cover inside a node. Percentages remain stable as the node is resized; omitted entries default to the center.",
			"properties": {
				"x": { "type": "number", "minimum": 0, "maximum": 100 },
				"y": { "type": "number", "minimum": 0, "maximum": 100 }
			}
		},
		"preview_url": {
			"$ref": "#/$defs/externalMediaUrl",
			"description": "Game only. Muted preview, never autoplaying audio."
		},
		"trailer_url": {
			"type": "string",
			"format": "uri",
			"pattern": "^https://(?:(?:(?:www|m|music)\\.)?youtube\\.com/(?:watch\\?(?:[^#]*&)?v=|embed/|shorts/|live/)|(?:www\\.)?youtu\\.be/)[A-Za-z0-9_-]{11}(?:[?&#/]|$)",
			"description": "Game only. Optional YouTube trailer; loaded only after an explicit play action."
		},
		"explicit": {
			"type": "boolean",
			"description": "Self-declared: the entry contains explicit adult content. Hidden by default; visitors opt in to seeing it in Settings. Omit for everything else."
		},
		"verification_token": {
			"type": "string",
			"minLength": 1,
			"maxLength": 200,
			"description": "Opaque string confirming submitter control of source_url or a third-party profile page."
		},
		"joined_at": {
			"type": "string",
			"format": "date-time",
			"description": "UTC timestamp this entry first appeared in members/. Set automatically by build-ring.js the first time a member file is built without one — never hand-edited, same spirit as verification_token being explicit rather than derived. audio-key-jay and comic-kjc-comix (present before this field existed) carry the date it was introduced, not their true historical join date; see docs/whats-new-feed.md."
		},
		"updated_at": {
			"type": "string",
			"format": "date-time",
			"description": "UTC timestamp of the most recent substantive edit, set explicitly by whoever makes it (the /update flow, or a maintainer editing by hand) — not auto-derived, for the same reason ring.json itself carries no generated_at. Omitted means never updated since joining."
		},
		"_placeholder": {
			"type": "boolean",
			"description": "Marks a seed or example entry. Real submissions must omit this field."
		}
	},
	"allOf": [
		{
			"if": {
				"properties": {
					"type": {
						"const": "comic"
					}
				}
			},
			"then": {
				"required": ["pages"],
				"properties": {
					"pages": {
						"type": "array",
						"minItems": 1,
						"maxItems": 3
					}
				}
			}
		},
		{
			"if": {
				"properties": {
					"type": {
						"const": "craft"
					}
				}
			},
			"then": {
				"required": ["pages"],
				"properties": {
					"pages": {
						"type": "array",
						"minItems": 1,
						"maxItems": 5,
						"items": {
							"type": "object",
							"required": ["image_url", "caption"],
							"properties": {
								"caption": {
									"type": "string",
									"minLength": 1
								}
							}
						}
					}
				}
			}
		},
		{
			"if": {
				"properties": {
					"type": {
						"const": "art"
					}
				}
			},
			"then": {
				"required": ["artworks"],
				"properties": {
					"artworks": {
						"type": "array",
						"minItems": 1,
						"maxItems": 3
					}
				}
			}
		},
		{
			"if": {
				"properties": {
					"type": {
						"const": "text"
					}
				}
			},
			"then": {
				"required": ["excerpts"]
			}
		},
		{
			"if": {
				"properties": {
					"type": {
						"const": "game"
					}
				}
			},
			"then": {
				"required": ["thumb_url"]
			}
		},
		{
			"if": {
				"properties": {
					"type": {
						"const": "audio"
					}
				},
				"required": ["type"]
			},
			"then": {
				"required": ["form"]
			},
			"else": {
				"not": {
					"required": ["form"]
				}
			}
		}
	]
}
