{
	"id": "comic-yuna2k",
	"creator": "yuna2k",
	"type": "comic",
	"why": "Currently developing MVNDY [techno, dreams and other dimensions]",
	"tags": ["comic", "techno", "blog"],
	"pages": [
		{
			"image_url": "https://mvndy.cl/images/Mvndypage_1.png"
		},
		{
			"image_url": "https://mvndy.cl/images/Mvndypage_2.png"
		},
		{
			"image_url": "https://mvndy.cl/images/Mvndypage_3.png"
		}
	],
	"thumb_url": "https://mvndy.cl/images/indienodes_cover.png",
	"thumb_position": {
		"x": 50,
		"y": 50
	},
	"source_url": "https://mvndy.cl/",
	"verification_token": "5ba239317a7ed085c66f5db617ac5b3d",
	"joined_at": "2026-09-23T17:46:42.426Z"
}
