{
	"id": "comic-kjc-comix",
	"creator": "KJC Comix",
	"type": "comic",
	"why": "We have the hot fire!",
	"tags": ["anime", "shounen", "manga", "action", "adventure"],
	"pages": [
		{
			"image_url": "https://dragonx3000.nekoweb.org/assets/page-1.webp",
			"caption": "Drift #7"
		},
		{
			"image_url": "https://dragonx3000.nekoweb.org/assets/page-2.webp",
			"caption": "Drift 10"
		},
		{
			"image_url": "https://dragonx3000.nekoweb.org/assets/page-3.webp",
			"caption": "Drift 20"
		}
	],
	"thumb_url": "https://dragonx3000.nekoweb.org/assets/icon.webp",
	"thumb_position": {
		"x": 50,
		"y": 50
	},
	"source_url": "https://dragonx3000.nekoweb.org/",
	"verification_token": "d8c1e37fba068cfcba7eec279141a16d",
	"joined_at": "2026-09-01T21:33:43.026Z"
}
