{
	"id": "comic-kjx-comix",
	"creator": "KJX Comix",
	"type": "comic",
	"why": "We do a multitude of different comics and styles, inspired by anime.",
	"tags": ["anime", "comics", "action", "adventure", "shounen", "slice of life"],
	"pages": [
		{
			"image_url": "https://dragonx3000.nekoweb.org/assets/page-1.webp",
			"caption": "Maji and Alzion"
		},
		{
			"image_url": "https://dragonx3000.nekoweb.org/assets/page-2.webp"
		},
		{
			"image_url": "https://dragonx3000.nekoweb.org/assets/page-3.webp"
		}
	],
	"thumb_url": "https://dragonx3000.nekoweb.org/assets/icon.webp",
	"thumb_position": {
		"x": 50,
		"y": 50
	},
	"source_url": "https://dragonx3000.nekoweb.org/",
	"verification_token": "9da21ee863d8430faaa1354bd8123a18",
	"joined_at": "2026-09-02T03:19:53.631Z"
}
