{
	"id": "audio-key-jay",
	"creator": "Key Jay",
	"type": "audio",
	"form": "music",
	"why": "I compose in a multitude of styles including VGM, Hip-Hop, Rock and more!",
	"tags": ["vgm", "hip-hop", "orchestral", "vgmr", "r&b", "edm", "house", "dnb"],
	"tracks": [
		{
			"label": "Should I Stay",
			"media_url": "https://file.garden/ao5Ld2QtA0WCEI6R/Should%20I%20Stay%20(MFiT).mp3"
		},
		{
			"label": "Weight of the Other Promise",
			"media_url": "https://file.garden/ao5Ld2QtA0WCEI6R/WotOP.mp3"
		},
		{
			"label": "Angel's Burning Blue Savior",
			"media_url": "https://file.garden/ao5Ld2QtA0WCEI6R/ABBS_Full.mp3"
		}
	],
	"thumb_url": "https://keyjay.neocities.org/assets/indienodes-keyjay/IMG_0481.JPG",
	"thumb_position": {
		"x": 50,
		"y": 50
	},
	"source_url": "https://keyjay.neocities.org",
	"verification_token": "b44d66453a90b0b287a95edb2bece2cc",
	"joined_at": "2026-09-01T21:33:43.026Z"
}
